Title,Artist
Across the Night,Silverchair
Bad Moon Rising,Creedence Clearwater Revival
Barking at the Moon,Jenny Lewis
Blue Moon,Billie Holiday
Bark at the Moon,Ozzy Osbourne
Blue Moon of Kentucky,Elvis Presley
Bugle Call Rag,Glenn Miller Orchestra
By the Light of the Silvery Moon,Doris Day
CAN YOU HEAR THE MOON,Grady
Canyon Moon,Harry Styles
Child of the Moon,The Rolling Stones
Dancing in the Moonlight,Thin Lizzy
Dancing in the Moonlight,King Harvest
Dancing in the Moonlight,Toploader
Don't Let The Moon Catch You Cryin',Ween
Drunk on the Moon,Tom Waits
Fly Me to the Moon (In Other Words),Frank Sinatra
Fly You to the Moon,Justin Vasquez
Grapefruit Moon,Tom Waits
Half Moon,Janis Joplin
Half Moon,Blind Pilot
Hey Moon,John Maus
Howling at the Moon,Phantogram
I Wish I Was the Moon,Neko Case
Man on the Moon,R.E.M.
Monkberry Moon Delight,Linda McCartney
Moon,Kid Francescoli
Moon at the Window,Joni Mitchell
Moon Song,Phoebe Bridgers
Moondance,Van Morrison
Moonlight,Grace VanderWaal
Moonshadow,Cat Stevens
Northern Downpour,Panic! At The Disco
Once in a Very Blue Moon,Nanci Griffith
Shame On The Moon,Bob Seger
Shiny Moon,The Teskey Brothers
Shoot The Moon,Norah Jones
Sing of the Moon,The Collection
Sisters of the Moon,Fleetwood Mac
Size of the Moon,Pinegrove
Song About the Moon,Paul Simon
Stand by Me,Ben E. King
Talking to the Moon,Bruno Mars
That Moon Song,Gregory Alan Isakov
The Killing Moon,Echo & the Bunnymen
The Whole of the Moon,The Waterboys
Walking On The Moon,The Police
What a Little Moonlight Can Do,Billie Holiday
Where Is My Moon?,Sivert Høyem
Who Hung the Moon,Jamestown Revival
Wolf Like Me,TV On The Radio
You and Me and the Moon,The Magnetic Fields